comment,date,stars
"Uber should review how to serve his customers. To delete my Uber account, it takes me 2 days and more than 10 messages-conversation with Uber Help Staffs (please review the history of messages)! It make customers like me scare and bore Uber! Let customers delete their own account as easy as creating an account! They also have no official notice by email to me about deleting my account and credit card informations.","April 21, 2017",1.0
"I have to have my vehicle inspected, no problem there. There was an option that I could do it via video chat, so I did. Through the Uber inspection page/site. Well they have no clue what I am talking about and that I have to upload documents that I was not given. I was told via video chat that Uber would get the inspection right away, 2 weeks later and still they do not have anything. I have tried to get a hold a person to verbally talk with and nothing. Just emailing and then there are more than one person trying to help and then it get aggravating. I think they have the worst service as far as helping the drivers. I am about to no longer drive for them because this is just getting out of hand. If you want to have great drivers give them better service when it comes to helping them.","April 21, 2017",1.0
"Driver never picked me up and I was charged a cancellation fee. He never arrived. I was waiting outside. He never found my home address. I contacted Uber and this was their reply: ""Thank you for getting in touch. We've reviewed this POOL trip and can confirm that you were charged a cancellation fee appropriately.""","April 20, 2017",1.0
"Let's be honest, who would mind paying couple $$ for a ride and relax in the back set listening to music and not dealing with traffic, especially here in LA. But Uber won't let you enjoy this convenience as much especially recently when they changed some of their policies. Here is an example, it is late at night, you just had fun in your friend's house and it is time to request Uber to take you home. You request Uber. Wait outside for the driver. In this phase, ETA become slow. 8 minutes waiting.","April 20, 2017",3.0
"I have been using Uber for many years (especially as a consultant, I used them weekly for my work travel to/from airports) but was disgusted with the way the company treated me as a customer. On 4/13, I requested a pickup from LGA, Terminal C, Pickup area 1. I attempted to call the driver 5 times to let him know my exact location at Terminal C pickup area but got his voicemail each time. I waited over 15 mins just to see him drive past the requested pickup area and continue to drive through all of Terminal C (as I was trying to chase him down) without slowing down or attempting to pull into any of the subsequent pickup areas to look for me. ","April 20, 2017",1.0
"Be alert for selecting UberPool for a reduced fare but being charged UberX or Economy at double the fare. When attempting to resolve, the company will state things such as 'we've adjusted a fare in the past for you' coupled with 'your fare is correct,' finally with a conclusion of 'your driver selected the trip in good faith.' I have been an Uber passenger on many occasions and never had a fare adjusted. My fare was absolutely incorrect and my driver selecting my trip is great, however, I wish to not pay a much higher fare for a type of ride I did not select. Uber leaves their customers with no additional help or recourse but to dispute charges with their credit card company.","April 18, 2017",1.0
I took an UberGo taxi today morning from my home (Tambaram) to my office MRC Nagar. I saw the payment estimate to be around 304-350 but I was charged 484. Added today is my first Uber ride. I also struggled with making payment via my card. I dont have payment wallet option so I have previously added my card details to the payment option. But the payment gateway through my card was not enabled. Need proper explanations from authorities.,"April 18, 2017",1.0
"On 4-17-17 I signed up as a new to Uber customer. I tried to schedule a ride for the following day, but not knowing how Uber worked I inadvertently requested an Uber driver for the wrong day. When the driver profile popped up I called him and told him that I had inadvertently order the Uber ride for the wrong day, he said (the driver's name was Javier) he would cancel the ride for me. I trusted that the ride was cancelled, but to my surprise another driver was on his way to my home (David), I immediately cancelled this driver and suddenly was confronted with a popup saying I was being charged a cancellation fee of $5.00. I never ordered a second driver, so I do not know how another driver could be sent.","April 18, 2017",1.0
"Uber driver and the people that work in the office is very unprofessional. They do not pick you up in front to your door, the drivers are always canceling and you're stuck with the driver's cancellation fee which is unfair. The only communication you have to complain is thru email which is stupid. It should be a phone number for you to dial and speak to someone.","April 14, 2017",1.0
"Concept of Uber is great. Try finding customer service is the pits. Once you contact them via messaging you will find that if you have an ongoing conversation, replies their system is set up to tag next available service rep. Meaning every time you send in your reply, a new service rep has to review all the conversations to get the rest of the customer’s problem. Extremely time consuming on both parts. My wife is presently texting them as I write. I'm not a patient man and have spent two three days going back and forth on a relatively simple question. ""How do I add my payment method to my account"". Simple right? What a BS management team they have. It usually lies on management too.","April 14, 2017",3.0
"On the evening of March 25, 2017, I scheduled an early morning ride with Uber for March 26 to Dulles airport. A few minutes after our requested pickup, the driver called and said he was on his way. We noticed on the Uber app that his vehicle was at Dulles and was not moving towards our location. The driver subsequently called and cancelled the pickup. Since we did not have sufficient time to make alternate arrangements, we drove our own vehicle to the airport and paid $272 for two weeks of parking. We noticed that the Uber vehicle remained in the same position in the Dulles area while we were in route to the airport. Up to this experience, we have been pleased with the Uber service, however, we will not rely on Uber again when we need to be somewhere at a certain time.","April 13, 2017",1.0
"I'm not sure anything is in place to go after this deceptive ""company"". I can't even call this a company. It's nothing, it's an app. The charging practices have to be illegal. They come up with their own rules and prey on anyone using this ""app"". I see them losing out on their ""app"" and lawsuits will start piling up. Everyone thought the concept was good, I'm seeing the loopholes and Uber needs to go.","April 12, 2017",1.0
"March 11, 2017 2:30 PM realize that the students I drive to Washington DC Stadium to see a concert for St Patrick Day... Did pee inside water bottle, and pee on the floor. Disgusting. Next damaged and scary one people, I was driving on April 02, 2017, cut with razors my leather seat and damaged also with cut the back seat. My Suburban car is new 2016, I work hard for to pay and Uber told me they will reimburse me if I send the estimation not later than 5 days. I did in 2 days, now a stupid guy in India or Philippines, who do not know what he is talking about say, something about and try to argue for something who was already agree. I can't wait to get customer service for drivers in USA!!! Drivers be aware please.","April 12, 2017",1.0
"I did one trip last month with Uber. But still I didn't get paid for it. I contacted with them. They all are liar. The day I did the trip same day I e-mail to them. They said “you will see in your partner dashboard.” But didn't show up. Then I e-mail again. They said 48 hours. After 48 hours I e-mail again. Now they are asking for information again. I said “how many times I've to give you information.” Then they ask for trip no. I said “the day I did the job from that time it's totally vanished so how I'm gonna give you trip no. Only I can give you passenger name, approximate time, pick up address and destination” and I gave it to them. Then they said again 48 hours.","April 12, 2017",5.0
"Just recently signed up. First time was good $10. Second time same route from work $25. I contacted they gave a refund. For the next Five rides to and from work no problem. On the sixth ride I got to location which was very short. Requested a ride. On walking out the door, I notice driver was still there, he told me cancel and Re-request and he'll get it, but while I tried to do that I got a message saying disabled account. And keep getting the run around with having sufficient credit balance in Uber gift credit and now I don't have a ride.","April 8, 2017",1.0
Visited Orlando Florida and used Uber twice to return from Universal Studio. The first day I was charged 15.88 and the second trip cost 9.34. When I questioned the first driver about the route we were taking he advised he missed his exit causing him to take the next exit which was completely out of the way. The second driver took the direct route with no problem. When I questioned Uber customer service they explained how algorithms work and found no fault with the fare. I received my receipt and noticed the total should have been 12.84. They did refund the $3 difference but refused to acknowledge the difference in price between the first and second driver even though it was entirely driver error. After researching this seem to be a somewhat common practice. Will use Lyft in the future.,"April 7, 2017",1.0
"I used Uber regularly as well as UberEATS. I loved the convenience! Once... Today I had a meeting across town. When it was over I requested an Uber pool for the cheap price and I had two hours before my next appointment. I'm thinking, ""shouldn't take more than an hour"". I was WRONG! The driver that picked my ride drove past me a minimum of 3x. I saw this on the little gps the app provides. The driver eventually started heading to the OTHER side of town! I tried calling twice to make sure he wasn't lost but he forwarded me to his VM both times and never reached out to me. Eventually, he heads away from my location and the ETA becomes even longer. ","April 7, 2017",1.0
"I recently had THREE Uber rides charged to my credit card, charges which my bank originally refused. When I complained to Uber via e-mail, I got a series of potted replies, with them eventually asserting that ""they believed the charges were legitimate."" Only after having the charges reversed with my bank and contacting Uber a fifteenth time did I get the explanation that my credit card details must have been acquired OUTSIDE Uber and then linked to an Uber account. This is NOT a very convincing explanation. ","April 6, 2017",1.0
I have had an ongoing complaint with Uber and it has finally hit the boiling point. I have been taking Uber quite faithfully twice a day for several months now and my pick up and drop off locations have never changed however Uber consistently changes the one address every time. I was OK with that since I was still getting where I needed to be until they started changing the quoted fees as well. When I called them out on it they would say that they had checked and that the information they had was correct. I have emailed them copies of the address plaque on the building where they are picking me up and they are still insisting that I am being picked up at a different address and that it is a longer ride and therefore a higher fare. The address they are insisting is wrong. Is the address for the commuter train station! The really irritating part is that the place that they are insisting I am being picked up at is the building where they house the trains!!,"April 6, 2017",1.0
I requested a Uber ride which I never received and was charged. I tried to get another ride in place of that ride and they're trying to charge me again. There is no one to talk to. You have to email to hear something back and no one has contacted me yet. I've heard all these good things about Uber. I will never use the services again.,"April 6, 2017",1.0
"Cell left in vehicle on April 1st, 2017 while visiting Colombia. Only way to contact UBER asking for help is by the web page. Driver did not answer or UBER did not contact the driver. I left several messages immediately and during the next following days. UBER only answered my messages more than 2 days later. Driver called over 2 days later indicating that the cellular was not there. UBER said ""no more to do"".","April 5, 2017",1.0
It has happened to me 2 times in a row that I had scheduled a ride and the drivers never showed up. I travel on regular basis and I schedule a ride a night before to the airport thinking I will be on time because of Uber. I missed my flight 2 times and never got refunded for my plane fare. I sent an email stating my complaint. The first time they never got back to me which was on March 19th 2017 6 in the morning. Same thing happened today. Also I had a flight to catch.,"April 4, 2017",1.0
"I live in SF and I will NOT use Uber (and Lyft) anymore because of rude driver behavior. I have found too many of the drivers, from those companies, don't follow basic courtesy of at least pulling off the road for a pickup or drop off. And I mean with a curb space a mere 2 feet away. In fact I saw a driver pick up a passenger in the middle of an intersection (granted it was a 3 way intersection). He block the traffic as is so often the case. Both companies need to list to their customer that the driver will stop at the closest parking or off road location. And drivers need to pull OFF the roadway.","April 2, 2017",1.0
"I used Uber once in a while because 1. they are really expensive. Their app has got problem. 2. I can not contact the driver in any way and every time I try to contact them it directs me to Uber Help which I believe there is nobody there to help. 3. You can never call Uber and talk to somebody, it sounds like to be that the whole thing is software and machine controlled. 4. If you by any chance cancel your ride they will charge you... 5. They are screwing taxi drivers, which are after and better. 6. Where I live they only have UberX which is nonsense and it is more expensive than Uber. They are making tons of money with their stupid application and system therefore I am deleting the app.","April 1, 2017",1.0
"They deducted total 202 Rs. for very short distance share/pool ride while showed only 54 Rs. while booking the cab. They first deducted 148 Rs. from my Paytm account after the ride completed on 22nd March around 8:30 pm. Then while I complained to customer care, next day they told they adjusted the fare to 54 and rest 148 will be refunded back in 3 days, and again deducted 54 Rs. from Paytm on 23rd March in the morning 7:53 am (I did not take any ride). So total 202 (148+54) Rs. deduction happened. Now after 6 days while I inquired asking about my money they told it was longer route and refund not processed. While I did not take any longer route after asking again and again. Also they only saying money is adjusted and no update about refund. Such a cheat.","March 31, 2017",1.0
"I was in NYC last night Wed 3/29/2017 with a friend. I came in by helicopter and was departing later the same way. I never requested a ride. Nothing on my phone showing I did. But there was 2 missed calls and a voicemail. 1st at 7:37 pm, then 7:39 pm. I called him back and he said he would need to charge me a cancel fee for not showing up. This has to be a scam, as there is no evidence on my phone that I ever requested a ride. I did contact Uber and they said it was a legitimate charge??","March 30, 2017",1.0
"Uber will lose the race to Ola eventually. The negative news they find themself surrounded in will soon bring it down. I did not give much to those negative news until I recently (28th March 2017) witnessed their lack of customer care. The Uber cab was requested to reach Ramaiah Hospital at 3.00 pm. He did, but he refused to pick up my aunt who was on wheelchair. She was released from hospital after full recovery but aged 91, we did not want her to walk. He zoomed away in style. What did that moron expect when a customer calls from a hospital. We called the reliable trustworthy Ola and reached home sound and safe. In the process Uber lost a potential base of at least 50 customers (all my relatives whom we shared this incident with and we decided to stay away from Uber).","March 30, 2017",1.0
"Had difficulty figuring out the app on my Phone and as a result had to cancel the trip as soon as I entered it, the address I had entered for home and the place I was going came up wrong. I did not notice this until I booked the ride. Soon as I realized the error I canceled the trip. I actually had this error several time and canceled my ride. I made several other errors in trying to schedule a future pickup time and had to cancel the ride again. ","March 29, 2017",1.0
"A week ago I tried Uber (hotel near LAX). I was told a car would be there in 5 mins but then the driver called and cancelled. A second one did the same and I got a cancellation message. However, I was charged $5. I reported it but all I get was a ""credit."" This has happened before - in NYC. Complained but all I got was a credit which I have never been able to use. In any other business this would be called scam. In future I will use a cab - at least I don't get charged when they are not there.","March 29, 2017",1.0
"I requested Uber 3/24/17. We were going uptown. I live 10.2 miles from downtown Nashville. My rate was quoted at between $15 and $17. We used Uber there and back. I checked my bank account the next day and to my surprise Uber had charged me $34.50 going to Nashville and $15 coming back. When I inquired about this I was basically given the runaround telling me that I put in a different address than where we went. Once I showed them the Google mileage and the receipt that I printed out from Uber showing that I put in the correct address, now they have changed it to ""It was a demanding night, so the fares went up."" That is really funny because the girl who drove us said it was a slow night. Uber overcharged then tried to lie about it. I will never use Uber again.","March 27, 2017",1.0
"I have been using Uber for a couple of years now. I use UberPool at least once a week. I recently requested a ride home from babysitting and was pretty upset when I was charged more than what I agreed to and that they wouldn't honor the initial price. The price I was told was $5.83, but when I got home I saw that it was $11.12. The driver did miss the exit and add more time and distance, so I figured that once I explain this to customer service that they would refund me the difference as this was not my fault. I hope that the driver didn't do this intentionally. They did not, and are standing by what they charged me. I am pretty heated and I am going to start to use Lyft as much as possible even though it is a little more expensive. I am super disappointed with their customer service.","March 27, 2017",1.0
"I woke up one day to find that someone had ordered a ride using my account in Philadelphia while I was asleep in New York. Naturally, I changed my password and sent an email to Uber's support team so that they could look into the issue. They did not look into the issue whatsoever, would not issue a refund, and failed to provide me with a number to call so that I could speak with a representative. Apparently, if someone steals your information from their poorly protected site/app and uses your money to pay for a ride, all Uber cares about is that someone paid for the ride. This will not be the only place I file a complaint.","March 26, 2017",1.0
"I have ridden with Uber 3 times, each time with drivers who are new to America and don't speak English. When I want to make sure I get English speaking driver, I have no way to call UBER. It is just easier to pay local cab a few dollars more for known drivers. I have deleted Uber.","March 26, 2017",1.0
"I have had a UBER driver who lingers in front of my apartment window... sometimes with headlights on and shining into my apartment. He lurks out there all hours of day and night. I have called the police and contacted UBER... nothing was done!! UBER response ""We cannot address nonrider complaints."" He drives a white Lexus in LA license **. Complain if you ever get this creepy driver!","March 26, 2017",1.0
"Requested a pickup in Seattle at 4:25PM on March 23rd and the request was accepted with a 7 minute ETA. I placed the pin exactly where I was standing in a very visible spot on a sidewalk that was easy to access. Watched the driver drive all around me on the Uber app but never coming closer than 3 or 4 blocks. After 30 minutes of this a message popped apologizing for the inconvenience, but the DRIVER cancelled, which now made me late for my dinner reservation. Adding insult to injury, I also saw that they charged me a $5 cancellation fee. I immediately disputed this and after many exchanges where I explained what happened and also pointed out that the driver far exceeded 5 minutes past the 7 minute ETA which entitled ME to cancel per THEIR OWN POLICY, the most they would do is ""promise"" a $5 credit on a future ride.","March 24, 2017",1.0
"Last Monday 03-13 I called Uber for a ride from Pomona Ca. to Ontario Ca. Airport. I got a contact and it showed approx. $18 dollars. All of a sudden the page went blank. I called Uber again requesting Uber again and the charge came up as $38.00 and gave a name of the driver and he was less than 10 minutes away. So I am in the parking lot of the business with my luggage, when he drove in. I waved to let him know I was the one. I am sure he saw me he was within 50-75 ft. away. Without hesitation he did a hard 180 degrees and sped out of the parking lot and was gone, without a word. I was a bit aggravated, So I dialed up Uber again. To the same pickup and same delivery points.","March 20, 2017",1.0
"I have been an avid Uber rider for quite a while. But recently, they've been in the business of disabling rider accounts for NO APPARENT REASON. I'm stranded in the freezing rain trying to request an Uber, and my account is disabled and they won't tell me why. They keep telling me it's for SECURITY reasons. Well I pay all of my fares so there's no reason for my account to be disabled. Today was the last straw. I requested a ride to work, which of course needed to be in a timely manner. The driver was initially around 5 minutes away. But 5 turned in to 10 minutes, which turned into 15 minutes. ","March 19, 2017",1.0
"The first time I used Uber, the driver rushed me (I had him waiting for 2 minutes at 4:30 am), didn't help me with luggage and was very rude. The next time, the opposite. So, it is a toss up, depending on the individual. I DID have a very bad taste in my mouth from the first experience.","March 17, 2017",3.0
"I took uberPOOL and the rate came to 13.40 and used promo code for $5 discount. While alighting my driver said to pay 8.40. I paid cash and alighted. Again on 16.03.2017 I took and it showed 10.90 I confirmed pick up. While alighting driver asked 15.90. I said ""why"" he said I had $5 balance to pay to Uber. I didn't want to block the road and cause traffic jam so I settled. Strange! Do you even have credit facility for Uber trips. I didn't give my card details only cash payment. Then how they let me alight for less fare and charge it later. Discrepancy in fares and that too after 5 days charging. I wanted to refund the extra $5/ charged to me but Uber complaint firm asks for my card details when I am dealing in cash only. I would like Uber co to clarify why I was charged extra. Now my trip list also doesn't show those previous discrepancy.","March 17, 2017",1.0
Used Uber while in Boston MA. Driver was excellent and knew his way around during peak driving time after work. We used Uber 3 times and always got to our destination on time.,"March 17, 2017",5.0
I took on a trust factor with Uber and I got ripped off and was left in cold and I suffered severe pain as well. The drivers are great but whoever is doing the money part they took too much. In return I had no way home. I kept telling them what they did. They kept showing me receipt when days before it was a lot lower.,"March 16, 2017",1.0
"I have been a loyal customer of Uber. I cannot even get a hold of anyone. The drivers have been great. However their charging system is unprofessional and unreliable. I am going to have to report lost or stolen due to them. They do surcharges which flash so fast you don't even get a chance to see their charges. They also start charging you for rides that you do not even take or had even requested or even authorized. This is how they get your money and scam you. I wouldn't trust Uber unless it is a once in awhile type of thing, because when you are a continuous customer they drain your account and if you don't watch it closely you could be overdrawn with many fees. Luckily I watch mine. I am going to have to go to Lyft. Hopefully they are better.","March 16, 2017",1.0
"I have used Uber in Miami Beach, Rio de Janiero, and Costa Rica. It is fast and convenient to get a car to my location, and the fact that there is no guessing what the cost of the ride is going to be is simply excellent. What I really like the most is the fact that you know who your driver is going to be and what type of car he is driving.","March 16, 2017",5.0
