comment,date,stars
"My account was hacked by someone in London who has been using it to bill rides for 5 days (starting 4/10). I cancelled/deleted my account via the App. The charges continued. I contacted Uber support via Twitter who told me to change my password - which I did. The charges continued. They have credited some of the charges but now the support team doesn't seem to be actually investigating my problem. I only receive ""boiler plate"" responses and no resolution. On 4/15 I deleted the account using the Web interface. I also deleted it again from my phone. I will contact my credit card company to deny payment for these rides.","April 15, 2018",1.0
I don't understand why Uber expect you to pay the driver for a trip when they have taken you to the wrong place. Because the drive GPS pick the wrong locate. I think that a Driver should check the locate where you're going when you live in a Big city when there a lot of places that sound and spell the same. Very dissatisfied. Very dissatisfied. Very dissatisfied.,"April 14, 2018",3.0
"I booked cab at 11 pm but the cab not at all moving towards my pickup location. I called driver so many times, but he was unable to pickup the call. Still I waited for 20 mins after I cancelled the ride. For this I need to bear cancellation fee. This is happened for so many times. My issue is not with fee and all. It's all about night time waiting for a ride after so many hours of journey.","April 13, 2018",1.0
"Wait time fee assessed being the following conditions are true. I ordered the Uber in the exact location I was standing when the Uber arrived. The Uber driver did NOT await on me one second as I was waiting in an obvious location that is easily visible from anywhere in the parking lot. According to the policy, although the driver didn’t wait for me - I was the one who waited. “A fee will be begin a few minutes after your driver arrives” & “We will notify you that a charge has started”. Neither of these conditions occurred.","April 13, 2018",1.0
"I had ordered a Uber cab and when I ordered it the fee was around $6, however once I arrived at my destination I received a notice that they had charged me extra fees without my knowledge or permission. I contacted them about this through Twitter and somehow my complete order was changed to the larger car, which I did not order. I guess they don't know that people get notifications when another device logs into your account because I received a notification that someone in Orange County had logged into my Uber account.","April 13, 2018",1.0
"When I first started riding with Uber a year ago the price was OK and when they were ""surging"" it was usually early morning, holidays and late night. Now it seems like the surging is constant. Price is one thing and another minute later it's ten dollars or more higher and it's not even a holiday or early morning or weather conditions. Drivers are charging fees for things that haven't happened, like spills, cleaning fees, burnt cigarettes. I don't smoke, but I learned early on always take pictures before and after your trips 'cause drivers will try to get you. They aren't ending trips on time, they're canceling without even getting close to the pickup spot. This company is out of control in pricing and driver and company customer service.","April 12, 2018",1.0
I've been using Uber for 2 years now. They started off as a great company but they've been steadily increasing their fares. I have noticed a trend with them as of recently. Several Uber drivers will sit in a parking lot and do nothing and jacked up the prices of rides. I go just under 3 miles to work and just under three miles back home. Not a very long distance but they tried to charge me as much as $40 S4 just 3 miles. ,"April 11, 2018",1.0
I took A UBER from Slidell to New Orleans which is about 30 minutes. Cost was ok. But on the way back it charged me 187$ for the same trip. NEVER AGAIN!!! I wouldve been better off to take my own car!!! THIS company should be fined for gouging and taking advantage of people. I do not recommend UBER to nobody!!!,"April 9, 2018",1.0
"Like many others Uber charged me multiple cancellation fees that were driver's fault, not mine. Instead of refunding my Gift Card, they issue me Uber Credit. That credit has not been used for payment on the 30 trips I have made since it was sent to me. I have sent close to 100 messages to HELP and they assured me that if I added more money on my gift card it would be applied on next trip. 30 trips and $350 later, credit still there. After 45 days of constantly getting rides denied for insufficient funds, when my gift card/Uber credit amount that is combined together in payment was more than enough, I went to Houston Greenlight Hub. They too refuse to help me out and actually had security force me off the property. ","April 7, 2018",1.0
I don't mind riding Uber. The only issue I have with Uber is some of their policy. It happen a lot to me that my Uber driver cancel because they lost and can't found where I'm located at the moment. And Uber charge me for the driver cancellation. That's not my fault if they lost. And I have to pay for that. When they refund you they give you a credit to use for your next trip. Uber is funny so they never lose and we already lose. I'm not happy about that and want Uber to start refund in our card. Thank God the trip was only 4$. Imagine a trip of 30$ that a driver decide to cancel because they unable to find you. UBER CHANGE THAT POLICY OR I WON'T USE YOU ANYMORE.,"Jan. 27, 2018",3.0
"THIS IS AN EXTREMELY URGENT MATTER AS I AM LOOKING TO FILE FORMAL LEGAL CHARGES ON UBER CORPORATION IN SAN FRANCISCO as their malice & lack of proper technology has caused me to lose approx. $700 income which I have screenshots as proof, but they made a mockery of me by ignoring my very emotional one hour visit, providing all of my proof, & they ever intended on helping me at all. The supervisor promised to get San Francisco headquarters involved which he never did as I never received any reimbursement to income loss or an explanation to why they are allowing this harassment to continue! I was given ""inside"" information on why this is happening to me only in the day shift and if it is true, Uber can be shut down for this!","Jan. 26, 2018",1.0
"In July of 2017 I used Uber Pool to go 1.5 miles from the Atlanta airport to my offices near the airport. I was quoted $5 to $7 dollars before I accepted. (I used Google Maps to book it, which Uber allows. If Google was the problem, which no one at Uber ever said, their problem should be with Google.) I got charged over $13. I wrote Uber and in their response they emphasized that what I am quoted before the trip will always be the price, ""no surprises,"" then went on to say they had reviewed the trip, and the charge was in line with what it should have cost, so ""you're good.""","Jan. 26, 2018",1.0
They claimed my gift card didn’t exist. Then said it had been used up. Then found it. Then charged my credit card anyway. Then refunded the charge. Then lost the balance of the gift card. Then said it didn’t exist. Then stopped communicating. Caveat emptor. There is no customer service worth mentioning.,"Jan. 25, 2018",1.0
I think it's very inconsiderate and inappropriate that you corporate people do not address the issue that your drivers have with this so called support team. I have been screwed over so many times this week by your support. We are pushed against a wall and there is nothing we can do but accept whatever resolution your so called specialist come up with. Which is so unacceptable. We send yall a grievance or an issue and yall refer it right back to the same people who did nothing to solve the problem only made it worse. My account keeps getting locked so I can't get my instant pay every... Every month. Why... I have my phone which the app is on my phone and you have to use my phone to get in my account to swipe my instant pay... Smh.,"Jan. 25, 2018",1.0
"On or about the middle of December I purchased a $50 gift card as an Xmas gift. It took Uber almost 3 weeks to send it to him. He did not get it by Xmas, but I overlooked it. He does not have a car so uses Uber often. I live very far from him and he did not know how to add the card to his app so had to wait till 1/22 for me to go visit him. Upon trying to put a code that is required in order to add funds to his account, I peeled off the code and the code was unreadable. After numerous phone call to Uber’s customers service number which brings you through a 3 question on winning a trip to Florida, Bahamas etc. which was a total waste of my time the person tells me I need to purchase another card and then they will refund my money. I am so far already out $50 I will not give them another $50 of my money. I am very frustrated and out $50. Buyer beware just give a Visa card and don’t purchase an Uber card. This is horrible.","Jan. 24, 2018",1.0
"Today I request two rides one to work and the other home. Both fares were a lower price and once I confirmed the ride, my charge was almost double. This is like bait and switch. Not fair to the consumer. I made a complaint and the person that handled it looked at the wrong date, she said I was compensated, I was not. So I came here. If they are doing this to me they are doing it to a lot of other people. Thank you.","Jan. 24, 2018",1.0
"Uber used to be the go to, now it's basically owned by third world. I paid for two rides and the idiot got me to destination 1 and cancelled and took my money basically. If you are in NJ say NOOO to the scam artist Yousaf in a Honda Accord license plate **. Another guy had the nerve to question me about my location and I was only 6 minutes away from my location. I almost got in 3 accidents in the last 2 days. One girl talking on the phone. The other guy I got yesterday was so nervous and scared and he admitted to me he's scared of highways. I'm done with Uber and if you had any brains people of NJ in the Wayne area you would too. Nothing but barely English speaking con artists.","Jan. 24, 2018",1.0
"I am being charge for a fare with Uber that is not mine. They keep telling me that a payment method that I used is associated with another account, so therefore the fare that has not been paid is mine. Then when I asked them to do research, they sent me an email that said for me to log back in using my email address. When I did that, they completely removed my account and gave me the account that was associated with the fare that had not been paid. When I told them that this was not my account. They emailed back and said it was and that the fare was consistent with other fares on my account. I told them this is incorrect. The account that was mine, I had used mine as early as 12/14/2017. This account was had not been active since 3/25/17. They refuse to remove this account from under my name.","Jan. 22, 2018",1.0
"Uber picked up my children in one neighborhood and randomly dropped them off in another neighborhood. The driver kicked them out of the car in a random neighborhood when his Uber software crashed stating that he would have no way to get paid for the ride (what happened to the safety of the children in the random neighborhood **). Zero excuse for this! We could have compensated the driver on his arrival. Who the ** drops off children in a random location??? Worst part of this ordeal? Uber double charged us 8.57 for this ride and we had to go pick up the children. Uber never refunded any of the money, so we're out 17.14 - thank goodness our kids were ok...","Jan. 20, 2018",1.0
I live in a city that has a cab company. The distances are short. I did a check. Uber charges the same amount for the same ride. I guess under certain circumstances it may be cheaper but for now I am staying with my cab company.,"Jan. 19, 2018",2.0
I was picked up on time by Antoinne in a White Dodge Dart. The roads had a lot of snow and he did not drive very carefully. His car skidded a little at one point and he ran a red light. I had to pray he would slow down. He looked like a very shady kid. I am a professional lady and he barely talked at all.,"Jan. 18, 2018",1.0
"Uber failed me as a customer! I was scammed out of a cleaning fee when the driver submitted a fraudulent claim against me. Uber says they have measures in place to catch false and fraudulent claims. That turned out to be a big fat lie! They never ONCE researched the validity of the picture submitted. Instead, I was accused and told ""no response needed"" at every turn. ","Jan. 17, 2018",1.0
I have had multiple experiences with the driver canceling and since it was over 15-20 mins I WAS CHARGED A FEE. Seriously? The driver cancels and I have to pay a fee???? Then when I messaged Uber they gave me an Uber credit? I don't use Uber often enough for a credit. I paid with debit card and wanted a refund on my debit card. It's very irritating. When I contact customer service about it they apologize and do nothing. Worthless! I will stick with Lyft.,"Jan. 17, 2018",1.0
"I paid Uber in advance to pick me up at Jackson Memory Hospital on 1/16/2018 at 6:30 pm for a trip to the Airport 'MIA' for driver with broken English could not follow the GPS correctly to pick me up. 1 whole Hour waiting. I was charge 5 time by five different driver that never made it to their pick-up, I never seen so incompetence driver that couldn't find the Biggest Hospital in Miami that been around for 70 years in the same location. Uber, I want my money back on my credit card or I will sue you in court plus attorney fee.","Jan. 17, 2018",1.0
"I lost my phone in the Uber last night. Attached to the phone was my credit card with a large limit on it. We panicked and cancelled the card. The next morning we called the Uber hotline and they had the driver call us. The driver searched the car and found the phone and the credit card. He drove 30 miles to return it to us. His name was Felipe and he drives in Ft. Myers Beach, FL. We were so impressed with his efforts to find the phone and to return it to us. He even questioned us to be sure we were the folks who ordered the Uber so he didn't give the phone to the wrong people. So wonderful to know that there are honest people out there who still care!! Thanks Uber Driver, Felipe.","Jan. 16, 2018",5.0
"I called an Uber ride. I called in plenty of time to make my bus which was not scheduled to leave until 9:40 AM! Since the ride was initially accepted at 8:50 or so, I had plenty of time to make it to 1727 Bedford Ave in Brooklyn, NY. But, Jorge CANCELLED the trip unbeknownst to me! After he called me on my phone to tell me he was in front of FedEx, which by the way, shares a building with the hotel from which I called him! I was staying in the NU Hotel on Smith St around the corner, less than 100 feet from where I was in the lobby at 85 Smith St. ","Jan. 13, 2018",1.0
"Don't bother using this company, they are pathetic. Uber sent a auto to the wrong address then charged me $5. for not coming out on time. Then Uber info has been hacked and 5 trips were charged to my Visa card. I notified Visa's fraud department and Uber. I gave Uber all the info with the dates, charges and trip code numbers. It's possible to get Uber on the phone. Uber keeps asking me via email for the same info I've sent. DON'T USE UBER.","Jan. 12, 2018",1.0
"I have been a driver for a number of years with Uber. They are big time crooks! Customers will show the driver the fares they are being charged (ex. $50) and Uber only pays the driver $11.95. The cut is supposed to be 80% driver and 20% Uber. They are big time liars and cheaters!! The so called 24/7 support line is also a Big Joke! It is outsourced to India and there is a serious language barrier. They never have a Supervisor available, however one will call you back. It never happens! They will deactivate your account in a heartbeat once you figure out their crooked and deceitful system of Lies and call them out on it! They can access all of your personal information through your Android, make it disappear, and blackout your phone with their technology.","Jan. 12, 2018",1.0
Yup. So Uber claimed that a 24 hour McDonald's was open. Ordered 30$ worth of food. They said after 30 minutes they couldn’t find a driver and canceled my order. I called back and made sure Drivers were available. They said they were. I placed the same order again. $30. Half hour later turned out that McDonald's wasn’t 24 hours and they canceled the order again. Found out that McDonald's doesn’t open until 5. Ok fine. Waited until 5 and placed a new $30 order. After half an hour again they had no drivers and canceled my order. Waited until 6am when village inn was open. Called to make sure a driver was available. Ordered another $30 in food. Again. A driver was not available. I called again to complain. ,"Jan. 8, 2018",1.0
"I reserved a taxi from my hostel to the airport which at that time was supposed to be between 11-19 dollars. Then 3 minutes before my taxi came I got a text that the price was going up (there was no exact amount mentioned). I had to catch my flight so I didn't want to cancel my trip. Eventually the price went from between 11-19 dollar to 30,40 dollar?! I complained about it at Uber but they won't give me the change back. Never am I going to use Uber again. This was the first and last time.","Jan. 8, 2018",1.0
"I wanted to finally write a review regarding obtaining help from Uber as a driver. This company absolutely sucks when a driver needs help with the app. I was driving with no issues for 4 weeks and then was placed as “waitlisted” for no reason at all as my record is spotless. After 8 weeks with no support at all or responses to weekly e-mails to the “HELP” feature all I got back was “I understand but please wait for 5-7 days for review."" Well it has been over 8 weeks during the busiest time of the year and still no help. Your company absolutely sucks with help.","Jan. 5, 2018",1.0
"Neither I, nor my friend had used Uber before but had heard their drivers were friendly from a friend of mine. On New Year's Eve of this year (2018) we (my friend and I) first used them to take us a couple miles from where we were to a club and it cost us $10, not including the tip. This was around 9:30 p.m. The driver was polite and was there within minutes of us ordering it. No problem. At the end of our night then, around 1:15 a.m. we called again to have them take us home. Now my house is roughly 10 min from the club so however any miles that is, I don't know, but when we ordered the Uber from the club the amount came to a little over $47. YES, I said over $47! And that was just to get ME home, without tip, and not even getting my girlfriend home! ","Jan. 5, 2018",1.0
"My experience with drivers is good in general. My issue is with Uber as a company. I won a certain number of rides with Uber ($25 off of a number of rides). I was able to use it up to a certain point. All of a sudden, Uber posted a different promotion on my account. This prevented me from using my original promotion (the way it works the last promo added is used first). I complained and after days and days of going back and forth with emails, I was able to use my promo again. Then, suddenly they changed the expiration date of the promotion. Now it expired on 1/2/18 instead of 4/30/18 as originally stated.","Jan. 4, 2018",1.0
"I have been using Uber for rides home from work for a year. I always pay the same. Today my 11.00 ride costs 20.52. Same time, same days. That is more than regular taxi charges. Ok, Uber. I hear you're getting sued many times, now I know why.","Jan. 4, 2018",1.0
"I signed up for Uber last night to check rates for travel from my hotel to a concert I'm going to next month. When I went into the app this morning, Uber had cancelled my account for supposed terms of service violation. I have only created the account and no rides even made yet, so how can I violate TOS???","Jan. 3, 2018",1.0
"I request a UBER on Nov 27, 2017 to pick up at Altamonte Mall to the Harbour at Lake Howell, the app said 3 mins but the driver never called until after 15 mins. We told the driver we are at David's Bridal beside Shoe Carnival standing, we stood at the front beside David's Bridal for over 20 mins never see the driver pull up. We got a call telling us he thought we were out on the road and he is leaving. My card was charged 6$. I have tried several times to contact Uber for a refund and no response. I would love every cent back. I am not going to pay for a lazy driver who want to collect under false pretense. The driver name is Linson, drives Hyundai Accent **. Need my money back.","Dec. 31, 2017",1.0
"Uber’s rules to ride are very unfair to consumers. Today, we got a Uber to take us to Fairfax, 30 minutes from Arlington. When the guy arrived, not only was his car visibly dirty, old and making loud noises, when we got in it smelled like my grandfather who owned and worked on a farm with pigs, when he use to come home at the end of the day. Yet, we had very little choice but ride — unless, as in the past, we refused and get charged $24 anyway. Which brings me to my next issue with Uber — there have been times we’ve ordered a car, got downstairs in the time it would take, and the car is gone! We get charged anyway. Unfair and ridiculous. ","Dec. 28, 2017",1.0
"**. That is the driver contact number who has no patience for his customers. My son ordered Uber, and the time he received his message, he went out but the driver had left by then... and ignored his calls, leaving him in a road that barely has any car passing from there. Then he finally replied and told him that he waited for so long... Seriously!! Isn’t there a charge for this time? The surprise is, when I called him to ask him to go back, he refused, and the second surprise is that my son had to pay for the car that was cancelled by Uber not by him... Great service.","Dec. 27, 2017",1.0
Gave wrong rating for the driver by mistake and asked customer care for editing the review. Answer was big NO to it. Sometimes people make mistakes and should be given a chance to correct it. My driver given an excellent service and I gave one star by mistake I felt very bad about. I spend too much time with customer service for helping to correct it. They said driver will not see who wrote the review so I needn’t worry about it.,"Dec. 25, 2017",1.0
"After driving for 2 weeks for Uber, I was expecting the $300 bonus that was promised after 50 rides. However, when I called, they said that since I made more than that, I’m not eligible for it. I was very mad and expected to receive the bonus in addition to whatever I made. However, they scammed me from the bonus as well as other drivers. DO NOT work or ride for them. They are an unethical company and scam their drivers from bonuses. I will not drive for them again and will discourage anyone from driving or riding for them again!","Dec. 23, 2017",1.0
"I have 35 dollars credits from Amex for Uber. When I made a purchase with credit in Uber Eats it only applies 1.61 dollar credit to my purchase, and I paid $31.51 when I still over $33 credit in the account. I contact customer service, and they told me they can't do anything about it. What a ** company.","Dec. 21, 2017",1.0
After multiple issues with Uber customer service over the years I deleted my account today. Last night I was dropped off in the middle of nowhere by my driver and had to walk 10 minutes to get to my destination. Where he dropped me WAS NOT LISTED AS THE DROP OFF point. The car also smelled foul. I spent the entire morning back and forth with Uber and they will not refund me for this trip. They are garbage. This is fraud and robbery from Uber.,"Dec. 20, 2017",1.0
When I applied with Uber for a drivers position everything went smooth. It only took 3 days to get approved. Then that same day everything turned into a nightmare. I unloaded the driver app. and was reading the legal documents which is required when all of a sudden it sent me to driving app. and I hadn't even finish or accepted what I had read. I could not find a place to get help. Then I get an email saying that my insurance expires on December the 26th. When I finally get someone online I tell them I sent them 2 Insurance cards. One that is the present card and one that is the renewal card and it is for 2 cars. The rest of the story is too long but I finally told them to call Geico. I can't believe that I was accepted in 3 days and I lasted 1 hour. I could have made them money. Oh well.,"Dec. 19, 2017",1.0
"I received a promo code from an event I was attending for $10 off the Uber, but instead the app would only apply the pre-existing 40% off the next 10 ride promo that was already activated previously in the app. I contacted customer support through the app to rectify and refund the difference of $5.13. Each time they replied with a scripted email that stated the last promo code added is the first to be applied and they cannot switch the order they are applied. First, their statement was incorrect because the app did not work as they explained and when I stated this they sent the same scripted response to me. This is deceptive practices and their refusal to fix over $5.13 is ridiculous.","Dec. 16, 2017",1.0
