comment,date,stars
"Uber has no method for allowing users to establish accounts with phone numbers that do not receive SMS messages. As a result, none of the apps I downloaded will work, and I cannot request rides. Their helpdesk has not responded to me with any useful information.","Dec. 18, 2018",1.0
They charged me a $125 transaction fee for a trip that costs $5.00. How is that even possible? This is a scam! I took a ride less than a mile and this is what I was charged. It’s unbelievable. I was way overcharged. It’s fraud!,"Dec. 18, 2018",1.0
"Suddenly Uber is adding an extra $2.50 to your ride. They call it a surcharge and when you complain try to explain that perhaps the driver paid a toll, even if the driver arrived within 2 minutes (literally) of your call. They are doing nothing more than taking more money and offering nothing in exchange. They want as much of your money as they can get their hands on. Beware. They'll call it any name they can think of. Tolls? Not. Surcharge? Definitely. More money in the Uber coffers. Rider beware!","Dec. 18, 2018",1.0
"I requested a driver to take me about 25 miles. The stated fare was $42.07...reasonable for the long distance, and I have a pass which discounts the trip afterwards. I watched on the app as the assigned car drove around about 3 miles away...then received a request to rate my trip, all within about 5 min of requesting the 25 mile trip. I figured the driver must have cancelled or something and requested a new trip. The second driver came and drove me to the requested destination. Same distance, same stated fare, no problem. I noticed later that I had been charged for both trips though. I know mistakes happen, so just messaged Uber to request that they refund the trip that did not occur. ","Dec. 16, 2018",1.0
"When I scheduled Uber to pick me up at 6AM and take me to the airport, the instructions I received stated that the driver would arrive between 6 and 6:10, and I would be charged every minute I was late. The driver arrived at 6am, I walk out at 6:05 only to find that the driver left!!! Luckily, I had a car and there was enough time to drive to the airport and park my car. Otherwise, I would've have missed my flight!","Dec. 15, 2018",1.0
I have been riding Uber premier cars for the past 2-years in various Indian cities. What I have seen is that the 100% of Indian Uber drivers as all the other taxi drivers in the country do not close their windows and use air-conditioning or heater (in winter) when they are not on a trip with their riders. The Uber drivers thus maintain a filthy interior with dusts of all kinds on all the cars along with mosquitoes freely 'roaming' inside the cars. ,"Dec. 14, 2018",1.0
I’ve been waiting a week for a check from them. I have auto payment for my bills and got charged $70 from the bank because I didn’t have the money in there for them. I called and was told it was a “glitch”. It shouldn’t take more than a week to fix. Asked to talk to a supervisor and got completely blown off. Terrible company to work with.,"Dec. 11, 2018",1.0
"Uber uses every trick they can to get you out of every penny. It’s sicking. The customer service suck, or lack thereof. The company doesn’t even have a number for the riders to call. I was charged for two different rides that I never took, this was three days ago and I still have not heard from Uber. This company needs to be checked. Our country has checks and balances just for scam companies just like this!","Dec. 11, 2018",1.0
My ride canceled itself within like 2 seconds of booking it three times in a row and got charged every time. This happened before and I let it slide but it happened three times in a row again. Money is being stolen here and help is useless. Very hard to navigate the help page and no contact email or phone. Thieves! Going on to their competition now... Should of done it long time ago!,"Dec. 11, 2018",1.0
"Recently bought an Uber with a few friends in Grand Rapids, MI. Once we got in his car he refused to drive us anywhere unless we gave him extra cash. My friend refused to let us give cash because she recently had been in another Uber in New York City who demanded extra cash and then kicked her out of his car. Never riding Uber again.","Dec. 10, 2018",1.0
"If your son/daughter uses Uber - beware. My son recently used Uber and was charged a $150 cleaning fee. The driver submitted pictures taken from someone else's ride, and claimed the mess was made by him and his girlfriend. He contacted Uber to refute these charges, and told them to check the date and time on the picture. Uber said they didn't have that information. Apparently they believe whatever their drivers tell them. He went back and forth with Uber. Finally, I sent an email and told them the driver would have that info, and we would seek legal counsel if necessary. They soon refunded his money. On a Google search, I found out many Uber drivers do this. They often set up their car to show a mess, use the same pictures over and over again, and even have a bank of ""messy car"" pictures they submit. My advice - take pictures of the inside of the car before you leave.","Dec. 9, 2018",1.0
It always shows as 5 min for arrival before booking the cab. As soon you I book the cab it takes 15-20 mins for the arrival. It still shows 12 mins arrival. You will not get to cancel the ride even because they charge cancellation fee for that. Always it has been a Worst experience.,"Dec. 9, 2018",1.0
"No show. Never again. Airport. Uber booked for 0815. 0810 driver cancelled. 0815 booked another. 0840 driver phoned - can't find the address. 0850 driver cancelled. 0855. Panicking. Tried again. 0915 Uber arrived, not mine. Driver said would cancel client and take me for 30 euros.","Dec. 8, 2018",1.0
"Buyer beware! Do not buy an Uber gift card. I received one as a gift, and tried to use it to take a trip with Uber. The card did not work. I have sent 25 requests to Uber customer service, and have been told 25 times that Uber cannot apply gift cards to rides and they do not issue refunds. Please do not buy an Uber gift card! Uber customer service does not help with gift card issues. The only way to contact Uber customer service is through the app. They do not have a phone number.","Dec. 7, 2018",1.0
"I needed to grab a ride in pouring rain for 3-4 blocks. I'd been given a code for discount ride that was never credited. Then found another charge of $40 on my card. When I made a complaint their answer was I had made a mess requiring cleaning. First off there is no way I'd made a mess with 1 small bag and just sitting there. And if I got seat wet, well it's pouring rain! I could of gotten entire car cleaned for that much. I'm handicapped and on a fixed income. This extra fee causes a hardship and actually takes food from my table. I've used this company for years and have had good and bad but this is robbing me and taking advantage of a trust with my bank info. Company cannot be trusted.","Dec. 7, 2018",1.0
"I schedule two Ubers for a trip to the airport for a group of 6. The first Uber arrived and took half of the group. The second Uber was late. As per their policy, I was credited $10 for being late. I could see the Uber coming up the street, then turn around and cancel us. He said he had car trouble. My guess is he had just been notified he lost $10 for running late and decided not to complete the ride. There were no other rides available for more than an hour. We had to drive ourselves and pay for parking for the entire trip, plus pay for the additional Uber which we would not have needed if I knew we were driving ourselves. Uber just sent a canned response/apology. Unacceptable service!","Dec. 6, 2018",1.0
"I was in the middle of my ride, maybe not even the middle 1/4 of the way to my destination and realized I can should switch my destination to another closer location. To edit your location, you have to click the search icon and edit your destination. Cool, However it wouldn’t let me. Inside the part where the search icon is and on top of that was a location symbol. Basically means you can’t change it. The location you picked is where you’re going. I figured this can’t be right and starting trying to get answers in why, I cannot change it. I was so furious!!! But because I selected a CHEAPER ride like Uber pool which makes total sense because it’s CHEAPER!!! But Uber won’t allow you to change it, if you selected Uber pool. Ok, I don’t get it.","Dec. 4, 2018",1.0
"We broke down in West Columbia, S.C. and had to get a hotel waiting for repairs. My wife downloaded UBER (we have never used it prior to this). A nice, polite man picked us up promptly and we were very happy with the $10.65 fare. After renting a car and returning home I find all sorts of charges (from Calif.), including one for $6,45 and a $99.99 TIP!~ Of course there is no way to talk to anyone at UBER and so far they have done nothing but ""Promise"" to correct it. We will never use them again and advise others to stay away!","Nov. 5, 2018",1.0
"A little over Two weeks ago, I was a rider in an Uber that go into a car accident when it hit a concrete divider in NYC., myself and my friend were injured and required transportation to the Hospital. We both have several injuries that require medical follow up, my friend suffered from a hairline fracture of her skull and Spin, I have several injuries ranging from concussion to neck injuries as well as knee injuries. My Doctor wants me to get follow up care ASAP but to date Uber has not reached out to use to give us any information. We have tried to contact them multiple times and get a RoBo response that they are taking this issue seriously but nobody has contacted us or given us insurance information. This leaves us in a bind in that we cannot make Dr. apt. without the no-fault insurance information.","Nov. 4, 2018",1.0
"I have been using Uber for 2 years now. Seemed ok, but recently I was charged for a ride I took months ago (I remembered the amount - 20.04) so I opened the app and looked into trips I've taken and amounts billed. I also checked my Paypal account to verify and double check payments, and Wow I have random charges that do not coincide with rides, I have one account of double billing, and three separate charges for 17.84, 18.84 and 28.46 that have no rides associated with the dates. One was on Christmas day when I know I didn't use that service. I contacted Uber but have yet to hear anything. I cannot find any phone numbers, and the app is not very helpful.","Nov. 4, 2018",1.0
"I had a promo on my account for at least a few months now. $5 off ALL rides in Toronto. It applied to Pool and Uber X. It would automatically renew. No issues. All of a sudden almost 2 weeks ago I noticed it was only on the Uber X. So I sent a message. They told me it was only applicable to X. This isn't a new promo code. It's the same. That was always applicable to Pool. You can't just change rules. You need to change the actual promo. I know 2 people who still have it applicable to Pool. After going back and forth for almost a week, now my messages go unanswered. Not even the generic message they send. Straight ignored. And I know they're waiting for the promo to expire which is either today or tomorrow. It's absolutely disgusting to have that kind of service. I've been a rider for 3 years. Took Uber EVERY day. It's a $5 promo. Which other riders still have. Sickened at the way this has been dealt with.","Nov. 4, 2018",1.0
"My experience with Uber has been terrible. There is no way to actually get in contact with customer service. I lost my phone in the back of one of their cars the other day. The only way to retrieve a lost item is to speak with your driver, however, my driver didn't speak a word of English. So I'm unable to communicate with him. Despite repeated emails to customer service explaining this, all I'm getting back are automatic reply email, telling me to contact the driver. Bad service. Will not use again.","Nov. 2, 2018",1.0
"Yesterday I took 2 Uber, like I typically (if not daily) use. On my uber ride home, everything seemed normal. I had a nice chat with my driver as he dropped me off from a 10 min ride. Hours after, I see my Paypal and Credit card statements, and realize Uber has charged me $150 for a ""Cleaning Fee"". They are suggesting that I made a mess to my drivers car. Apparently, the driver sent them a generic picture of a wet at and charge me $150. Mind you, this extra charge/modification was made some hours after my ride was completed.","Nov. 2, 2018",1.0
"My driver stole my phone and Uber did nothing about it. I corresponded with their help desk for a week and I only received stock emails. After they were unable to contact the driver, they stop responding to me but they have continued to let him drive under the Uber brand. BEWARE! You may be his next passenger.","Nov. 1, 2018",1.0
"I used Uber last year and loved the service. I again ""attempted"" to utilize Uber last night (Halloween) for my 16 yr old daughter. Guess what? She ended up stranded miles from home due to YOUR inept incompetence. Needless to say, our Uber days are over. BEST TO BE AVOIDED/NOT CHILD-FRIENDLY! We will be utilizing Lyft from this point forward. Choose your merchants wisely!","Nov. 1, 2018",1.0
"I've been using Uber for years with no issue. About 6 months ago I started receiving an error message saying 'something went wrong' and could get past the ride search without this error. I contacted customer service via their website form (since you can't email or call anyone to explain your situation). Uber support could not figure out the issue. After 3 weeks of back and forth with the support staff, I had them delete my account and was told I could sign-up with the same email after 30 days. I've since downloaded the app again and cannot sign up using my email or phone number as Uber says it is already in use.","Oct. 31, 2018",1.0
The most cunning app I have found so far. I took an Uber lets on Friday. It cost me 34.00 And then next day I requested for Uber the app says I have pending transaction even though I had money on my account. I requested for Lyft. I was able to reach my destination. Spoiler alert get your ** straight Uber. Call me **.,"Oct. 31, 2018",1.0
"Riccardo, Honda Civic, license plate ** in Los Angeles was to pick me up at LAX. Waited only 5 minutes and he texted me to confirm where I was going. He said he would be there in a minute. He pulls up 20 ft from me, and as I walk out from curb he just takes off. I texted him saying, ""Where are you going?"" He said, ""I don't want to take you"" and then charged me a $5 cancellation fee despite he's the one that cancelled it at the last second. Riccardo you're a jerk. Your Uber profile states you drive because ""Need clients to support myself and loved ones."" Such baloney ya loser.","Oct. 31, 2018",1.0
"My initial issue with Uber started back in August 2018. My first attempt at opening an account was on August 2nd after attending a concert with my friend. Keep in mind, this was the FIRST time I have ever opened (or at least tried to open) an Uber account. After I provided the necessary information, I was given a big red error message saying that my account had been disabled. How my account had been disabled even though I never opened an account is beyond me. At any rate, I figured I'd go to the website they provided to reactivate my account. As I'm trying to do that, the request wasn't going through. After multiple attempts I gave up, and I had my friend download it and we were able to get home. ","Oct. 30, 2018",1.0
"I had been using UBER since 2014, and had been happy with the services until the beginning of 2018. In the beginning of 2018, I would try to request a ride through the UBER app, but for some reason, the request would get denied and there was no explanation at all on the app. After months of trying this, I reached out to UBER a few times through my account and through their Facebook page. When they responded via their Facebook page, they stated that they will send an email to me to my email address. When they sent their email to me, it stated that my UBER account was suspended, but did not state the reason behind it nor did they state the time frame of the suspension. I was never made aware of the suspension until this email was sent to me. ","Oct. 30, 2018",1.0
Please be careful when using the Uber app. I have had to cancel the second debit card and am still waiting for Uber to refund my account. I found several fraudulent charges. Not only has this happened to me but it has happened to my daughter as well. I will remove the Uber app from my phone as it is apparent that their security measures are nil and that the customers are vulnerable to having their card numbers used for other rides. Since there is not a human being you can speak to and communication is only through emails this is extremely frustrating. I have used other ride apps and Uber is the only one I have had this issue with.,"Oct. 30, 2018",1.0
"After my husband and I spent 50$ on a trip in July and got a receipt for said trip I pretty much forgot about it until a few days ago (October 27th) when PayPal notified us about 50$ coming out of our account from Uber - we panicked, thought there was some kind of theft going on and an hour later got an email from Uber explaining that, somehow even though we have a receipt we didn’t pay them and 4 months later, without warning they were taking 50$ from us. I remember this money leaving my account because it was a high cost ride, but seriously at best I’m misremembering and only thinking of the official receipt I got from Uber in which case they should write off their mistake or at worst they are double charging me.","Oct. 29, 2018",1.0
"I usually take the bus or train to the airport but Thursday morning Uber Express Pool cost only $5 more than my usual bus or train so I decided to go for that. First thing is that Express Pool seems to make you wait 5 minutes before connecting you with a driver. When it did connect me after 5 minutes it told me to walk a block to a nearby corner and the driver would be there in 4 minutes. 4 minutes became 9 minutes, then 11, then 16 and it became clear from the map that the driver was heading to the airport without me. ","Oct. 28, 2018",1.0
I took Uber in July and suddenly I receive a charge on my credit card October 26. They are billing people for June and July!!!! I received a receipt in July. How is this possible? The number on the credit card receipt for Uber isn’t a valid number.,"Oct. 28, 2018",1.0
The Uber driver broke my luggage when he loaded and unloaded it into the trunk. I was trying to put the handle down to separate the luggage and he said he had a better way not separating them. When he took it out at the drop off he handed me a piece that broke and said casually “this came off.” The arena to engage the pull up handle release was broken.,"Oct. 27, 2018",1.0
"Thanks for ripping 60 bucks out of my bank account 4 months after the rides took place. Rides took place in June and July. 4 months later, October 27th you take money out of my account. I already paid it once.","Oct. 27, 2018",1.0
"My husband and I decided to take the train going to LA Union Station and take UBER to Convention center for my citizenship oath taking. We don't want to be late for my appointment, it's very important, but unfortunately we contacted 3 drivers, but it seems that the 3 drivers can't find us, but we put the right address where to find us and suddenly it seems that the drivers cancelled our rides and on top of it Uber charged us twice for $5 make it $10. Hello Uber? I will never ever use Uber, very disappointed!","Oct. 26, 2018",1.0
"Fraudulent promotions - I wish I could give them a ZERO rating! I’ve had many problems with Uber in the past. This time it is it!! NEVER AGAIN! I signed up a new rider using my link and I was suppose to receive a monetary credit toward future rides. They issued it in Taiwanese dollars!! Does that make any sense?! When I emailed them 3x, same generic response, you can’t use Taiwanese credit for your fares. Umm I know! Then why did you issue it?! I didn’t use, apply, or signed the person in Taiwan!! Seriously the worst company and I don’t know how they still get away hiring criminals as drivers!!","Oct. 26, 2018",1.0
"Never again will I use Uber. While in Vienna, Austria we took an Uber to the city center from a Marriott. The return trip from the city center was a disaster because the driver (Suzana) took us to the wrong Marriott and would not take us to the correct Marriott. She made all 5 of us leave the vehicle. We are 5 women, all 70 years or older, at 10:30 at night, in a foreign city, in a dark and isolated area. We had to get a taxi to return to the correct Marriott. Personal safety is not a concern to Uber and that in itself is a crime.","Oct. 26, 2018",1.0
"I ordered an Uber ride today going from Lafayette Street and Worth Street in lower Manhattan and going to New York Pennsylvania Station. I was instructed to meet the driver at the corner. After waiting for some time my mobile phone alerted me that the driver canceled. I then ordered another car and it said that the car would arrive in 8 minutes. After waiting about 20 minutes there was ""NO CALL and NO SHOW"". I found myself having to take the subway of which I was trying to avoid. ","Oct. 26, 2018",1.0
"I urge you, do not use Uber. They are well known but as you use them please be sure to look closely at what they are charging and when they are charging. I strongly emphasize on the when. They charged me on a ride I never used even after I said they are not authorized to. I have record of the trip history as canceled just 2 seconds of calling for a ride and they blatantly ignored it. Never addressed that this was an unauthorized charged. 90 days after this trip, I was sent an email 3 days ago from them stating they will charge me because their system made a mistake. Shortly after this, I figured out that their loophole is to close the account 30 days after your trip so you cannot dispute it then send a notification 90 days later saying their system made a mistake to a ride that will be charged 14 days later. ","Oct. 25, 2018",1.0
My daughter's Uber account was hacked and you cannot find a single number or chat to have a conversation with Uber directly anywhere. Uber appears unreachable unless you have a safety issue with a driver...otherwise they appear completely unreachable by design.,"Oct. 24, 2018",1.0
"I was a first time user yesterday, using a Samsung 7 Android and the Uber app, which was set up a week ago, in order to establish an account. It was around 6 pm and needed a ride to the hospital, was attempting to schedule a 6:30 am pickup the following morning. The app appeared to provide a 'Clock' to schedule, which I used, but prior to confirming there was no indication that the time would be 6:30 am. Thinking it was a screen update issue, proceeded and the time reflected 12:50. There is no way to edit, so I cancelled immediately and tried again, paying careful attention and again I ended up with 12:50, so cancelled that and had my Daughter add me to the 'Family' option, which worked out from her end.","Oct. 24, 2018",1.0
"Uber has hold the full payment for already cancelled trip. They did not void the payment. Be careful when you used Google Pay to do Uber payments. If we cancel the trip, Uber will hold the full amount. They will not refund it.","Oct. 24, 2018",1.0
"I'm going to share a story about why I will never use Uber again. A month ago, my Uber account was hacked. In fact, AMEX confirmed to me that they had SEVERAL people calling in to say their Uber accounts had been hacked that week. Nothing on the media - strange? Within a 4 day window, 118 rides were charged to my credit card in USD - each totaling over $120+ CAD... Resulting in $8,200 of wrongful charges to my AMEX (thankfully I have fraud protection on my CC, so it was on Uber's end to stop the charges). Even though I alerted Uber immediately when it happened, it took them 4 DAYS to STOP the charges from being incurred/charged to my card.","Oct. 23, 2018",1.0
"A short while ago my social media was hacked, and it expanded into many of my accounts (Uber being one of them). I then went on to delete my account but Uber has a policy of leaving the account open for 30 days after for possible reactivation. This led to the hacker reopening my account and using my credit card. I have since had to change all my cards. After trying to find a number to call (which they do not offer for riders) I emailed them to try and get my account deleted immediately. After 3-4 emails back and forth with them all they have done is ""refund my money"" (which they said was completed, to a card that is no longer valid) and mark my account for deletion in 30 days (allowing that individual to open my account at their leisure). I would not recommend this service to anyone if they value their privacy.","Oct. 22, 2018",1.0
"I have been using UberX twice a week, every week since July 2, 2018. On Monday morning I use Uber to go from my house in Mississauga to Pearson Airport, and on Friday early evening I use Uber from Pearson Airport back to my house in Mississauga. Every Monday and Friday exactly at the same time and the same route. Every time Uber charges me different fare, not even two times were the same or even close. Last week they decided to charge me extra money three days after my trip to the airport for unknown and unexplained reason. Uber thinks they can charge you anytime because they have your credit card information. It’s completely a rip off and totally inconsistent charges for the same trips at the same time. I decided to cancel my Uber account and use regular taxis or Lyft; no more Uber anymore.","Oct. 22, 2018",1.0
