comment,date,stars
"I had seven fraudulent Uber transactions over three days in mid-October on my credit card. For nearly a week, I tried unsuccessfully to get Uber customer service to help. Uber was totally uncooperative. They refused to engage in the fraudulent charges someone in their system imposed on me. I had to cancel my credit card, get a new credit card and leave my credit card company to battle awful Uber. Uber buyer beware. I know I will never use their services again.","Oct. 21, 2019",1.0
"Our driver never showed up and Uber cancelled our ride, not us. They charged us a cancellation fee for them cancelling. When I disputed it they would only credit it on future ride instead of refund back to our credit card. Why am I only getting a credit on account instead of a full refund to my credit card used?? This is not right what you have done when it was a Uber error.","Oct. 21, 2019",1.0
"When the service worked, it was good, and tech support responds quickly most of the time. Unfortunately, that doesn't make up for the problems I encountered. The app rejected my credit card and offered no explanation as to why. For some reason it accepted my PayPal even though it uses the very card the app had just rejected. It took days of back and forth with tech support to find out that my card ""isn't compatible with their system"", but they refused to be more specific than that and no matter how many times I asked what the exact problem was (ie my bank, the type of card, etc) all they did was rephrase the same answer over and over again with canned responses; repeatedly telling me to check w/ my bank, even after I told them I already had done so.","Oct. 20, 2019",1.0
"Being a responsible driver, I made the decision to use Uber after a few drinks at a local cantina. My friends and I live within a couple miles of each other, so we shared the Uber. I was the second person to be dropped off and my sole set of keys (i.e. car, house, storage, work) fell out of my pocket. I realized I had left them in the backseat almost immediately, but had no way to contact the driver bc, unfortunately, my friend was the one who ordered the ride. My friend contacted him the next day (that was a feat within itself bc Uber drivers are extremely protected), but did not receive a response.","Oct. 18, 2019",1.0
"They didn’t have cars available at Bush International Airport on October 15, 2019 at 9:30 pm. Had to take a taxi. This is the second time I have experienced this, and will be my last as I will use Lyft or a taxi in the future.","Oct. 18, 2019",1.0
"I have been punished for circumstances beyond my control. I have asked repeatedly for someone to tell me what I have done wrong or could have done differently and no one will talk to me about it. You see, I am a driver for Ubereats, and I loved it until Friday night when I had several orders not completed due to circumstances outside of my control. 2 orders could not be delivered because the restaurant wasn't serving the items at that time. ","Oct. 17, 2019",1.0
Upfront pricing not true pricing. Uber pads the bill so much. I've had Uber drivers charge for wait time when they are parked down from my house and I am out on my front porch waiting and watching them. Booking fee $3.05 come on! Toll and surcharges plus time and distance charges. Now they are dropping me off a few blocks from my destination saying they got to take another call. Uber drivers that I have used have showed up at my house wanting a hookup. One driver started groping me on my front porch. Uber customer service is a brick wall. Credited me $3.00 on a ride on Uber Cash. No matter what they do or charge they have an excuse and they are right. When I reported the sexual harassment of the two drivers they suspended my account. They cost more than a taxi and a taxi never has told me to get out and walk the rest of the way. ,"Oct. 14, 2019",1.0
"Drive with Uber you need to get better. I currently drive for Uber but am concerned with some drivers taking advantage of people with disabilities. I had picked up a Uber customer who had a 3 star rating, which to me I thought there was something wrong but still decided to accept the ride. When I picked up the gentleman I realized he was blind. As he got in my car we had a conversation and he told me that I was the quickest pick up he has ever gotten and asked me why. He told me he usually has to keep requesting Ubers over and over. I know why. It’s because the drivers are declining a 3 star rider. I told him it was because I don’t pass up any opportunities to pick people up to get them to their destination. He was the most kindest man I have ever met and I realized that other drivers have given him low ratings just because he had a disability.","Oct. 13, 2019",1.0
"Driver was fine and so was ride. Experience of dealing with getting a coupon for first ride had me looking for a human being to talk to, and was amazed to find there was no one. I think they charge enough to hire customer service of some kind. I couldn't even find a human online.","Oct. 11, 2019",1.0
"Cherry picker???? Asks you where exactly you are going after he picks the order, asks if the lady is going alone, calculates if it is good money and company, then cancels the trip if it is not. You cant review him since the trip hasn't started, so he has pretty nice rate level. Happened to me, not sure how many people he has innocently questioned like that and cancelled the order.","Oct. 6, 2019",1.0
"I had few miles missing on my trip and called customer service for help, verified who I’m to them and explained myself that I was missing few miles and ""can you please check for me."" He said, ""Allow me 2 minutes,"" said ok. He came back, ""Yes you are missing something. Allow me another 2 minutes. Said ok, come back and said, ""No you were paid correctly."" Answered him, ""No worries, please let me talk to a supervisor."" He replied, ""I just answered all your question and no supervisor available."" 4 times tried to get a supervisor on the phone. He refused. His name was Michal and I told him that, ""In America the way things works if you can’t help me I need to escalate my concerns to a supervisor.""","July 24, 2019",1.0
"So I took an Uber to the hospital for a medical procedure at 11:30 in the morning. Then that night at 11:30 at night a random man calls me to tell me he’s here to pick me up for my Uber. I said, ""No, I do not have an Uber now. I am asleep after having surgery."" The next day I see I am charged for that decline of service. I contacted Uber - they tell me they will take the charge off but it is not been taken off so far and I also have been charged twice for the original trip! I know that there is a pending and then there is a regular charge. I have one pending and two FULL charges of almost $40.00.","July 23, 2019",1.0
"The driver incorrectly the wrong pick up time and also the wrong drop off location. This prompted me being overcharged and UBER is refusing to provide a refund for BOTH mistakes. They claim to have ""dealt with my poor experience by dealing with the driver"" but will not give me my money back. They just lost another customer for $7. DONE USE UBER.","July 23, 2019",1.0
"We ordered an Uber car to get to a concert. They said they would be there in four minutes. We received a text he was there. As we went out the driver called that his GSP took him to the wrong place. As we are waiting my friend gets a text the driver cancelled!!! As she was trying to see what happened to the money she had just paid she was charged for the cancellation!!! We didn’t cancel, the driver DID!!! Call a cab. It is quicker & CHEAPER!!!","July 23, 2019",1.0
"I’ve driving Uber for over 8500 trip in the last 3 years, with an overall drive rating of 4.91 and an excellent riders' reviews in my account. All the time we call the customer support team about any problems we have, they just don’t expect them to ever listen to you!! Last week I have a rider vomited and peed inside my vehicle and they refused to send me a cleaning fee. I talked to 5 different people in their driver's support team, but it seems they are ignorant and it seems Uber trained them to always provide the same answer. Even though I was doing Uber full time as a driver but never again. IF YOU GUYS REALLY WANT TO BE A SLAVES THEN YOU CAN WORK FOR THEM.","July 16, 2019",1.0
"First ** time I called you, my drivers says, ""I can't make it. Cancel it. You wont be charged."" I cancelled it, I was charged. ** horse ** Richland, Miss. Jackson, Miss. area... He told me to cancel it. Like why did you take the job if you couldn't do it. Oh so you could make 5 dollars for doing nothing. Piece of **. Nissan Altima.","July 14, 2019",1.0
"Uber does only lip service in term of driver quality in India. A large number of uber cars are dirty, Acs hardly fictional, Drivers trying to defraud and overcharge, UBER customer support in India is dismal. I had a driver overcharge me by 200 rupees and Uber offered to refund 10 rupees. Joke!","July 12, 2019",1.0
"I requested a ride from Fort Worth, South Henderson Street to Irving Texas. The upfront fare they showed is 40.50 for economy ride and they said I have an offer of 25% max of 10$ per ride discount so it will be 30.50, then this driver Aashish in Toyota Corolla ** came and literally said “Oh I was going home"" and I got a ride which is exactly close to my home that’s convenient for him he said and then he took his own favorite route as per his wish and then at the end they charged me 8.96 dollars extra apart from 30.50 saying the toll charges, which means the total fare is 49-50$?? In a non busy period, that is never a fare till now. It’s maximum 35-36 and or 38-39 in a busy time. ","July 11, 2019",1.0
"Earlier, Uber was great. They used to provide prompt customer service and quick redressal of issues. Now, there is no person you can speak to, there is no acknowledgement even if you complain and random multiple charges are being deducted for the same trip. Thank God for Ola, otherwise UBER is such a scam.","July 10, 2019",1.0
"I have been using Uber as a rider from 2016 with a good passenger rating. Never had issues with any driver and my experience was in general good. A month ago Uber disabled my account. I reached customer support and after a few email exchanges, customer support sent me a rude (and offensive) email that I have violated the terms and conditions. I can safely say that this is truth challenged. I have no duplicate accounts, I am quiet as a rider and cooperative and never caused any issues. I asked customer support if there is a mistake and if they can lift the suspension but they ignored my request. This is no way to treat a client. Uber deals with problems because it cannot handle the vast clientele it has currently and makes mistakes, but this is no way to treat someone like this. I believe that TLC should investigate further how Uber is operating in terms of customer support, as well as monitor it much closer.","July 8, 2019",1.0
"Uber Eats cancel order without refund. @UberEats Hi friends. Don't order any food from Uber Eats. He will get your money and do not deliver your food, That is my experience and story. It can be with you and Its customer support will not resolve your problem. The delivery boy did not come at my home.","July 7, 2019",1.0
"My daughter called for an Uber pick up and was told no driver was available. She called a few more times in hopes that a driver would become available. She was charged $510 (5x $102), but no driver ever showed. Uber refuses to refund the $$. They are insisting that the refund must come from my daughter's bank. It is illegal to be charged for rides that never came. Uber repeatedly stated that no driver was available and yet they charged her anyway!!!","March 18, 2019",1.0
"I took Uber from IGT 1 to Sector 25 Noida and it shows rent of 820 approx. on Uber Premier, which looks good but when I reached my location without any stoppage driver asked me to pay 1210 rupees which is totally disappointing for me as prepaid taxi outside airport is even charging 950 rupees. But when I cross checked with my trip charges then I was shocked to see billing of 835 is showing on my app. I asked the driver to talk to Uber and check the same but he refused and asked to pay his charge as per his Uber application and write mail to Uber for the claim. I do took pictures of driver's mobile application screen and there is no transaction or reference number to track. Only amount, date, location is shown in it and same is with my trip detail in my Uber app. When trying to download receipt of this trip it's not opening as Uber Lite is not supporting this function. When trying to download Uber application it's not getting download. ","July 6, 2019",1.0
"So my husband and I thought to let everybody know about our experience in New Orleans with Uber. We will never take Uber again. We went on vacation to New Orleans to take a cruise. We arrived the day before, The suggestion from our travel agent, just to make sure that nothing went wrong. We are new to Uber and our ride from the Comfort Inn Suites at the New Orleans airport to the Port of New Orleans on Feb 7 was the first time using Uber. This was at the suggestion of the Comfort Inn Suite and we were happy with the service that was provided to the Port of New Orleans. Mileage of 14.34 and drive time of 36 minutes as recorded with a value of $21.78. ","July 6, 2019",1.0
I was in Montreal last week as it was raining. Wanted a quick ride to my destination so booked an Uber. The amount displayed was between 27-35 (which included surge). I didn't mind it as I was running late and wanted to get to the destination on time. Unfortunately there was an event taking place at the location and the cops had blocked some of the roads - due to heavy traffic and roads being blocked it took me 50 mins to get to my destination as opposed to 20 mins and to my surprise at the end of the ride the driver told me there is waiting time added to it which I wasn't aware off as Uber doesn't tell you the amount right away. You don't have the visibility as you do in most cabs. You can see the meter and make a quick decision of either taking the ride or stopping it right away.,"July 3, 2019",1.0
"Launched app, was quoted $47 for the 30 mile ride home, what I expected, and what I've paid generally dozens of times. Got picked up and was later billed $133. Triple the quote. Uber says I confirmed the change. I did not, nor would I ever do so. I could have taken a limo for less than that. Dispute denied, just shut up and pay. I fired Uber, and will never use them again.","July 3, 2019",1.0
I placed an order on Uber Eats and the food never showed up but I was charged anyways. I called to tell the customer service reps but they ignored me. The food never showed up and now I can't eat my lunch because I gave my last money to eat today. This is completely unfair that my food never shows up and I still got charged! I want my 13 dollars back!,"July 1, 2019",1.0
"Customer service is absolutely terrible. I have recently been locked out due to some background check. In the middle of a fair mind you. I recently relocated to a different state and have a different driver's license. The old state driver's license was still active in my account but due to it no longer being a valid license, and I supplied the new one, the background check failed and now I have to wait 7-15 days for a resolution.","July 1, 2019",1.0
On Thursday 27/06/19 I lost my wallet with a significant amount of cash and important identity cards and ATMs. Tried to call Uber. There are no customer helplines. Uber allows to connect to drivers but the driver had picked other rides and so that leaves me knowing that the next rider might have taken up the wallet but I can't do anything about it.,"June 29, 2019",1.0
"Drivers take longer routes just to charge you money and they don’t give you, your money back. I had the worse taxi experience with this company, driver turn all the way around and they charged me distance and long and they didn’t want to give me my money back.","June 28, 2019",1.0
"I ordered an Uber around midnight, it said it was going to take 9 minutes so I waited, left the club with 1 min to spare, saw the car pull up, got in, only to be told the taxi wasn't for me - he hadn't even asked my name!. He said he wasn't taking me and to get out and drove away. I looked at my phone and it came up driver has cancelled. My original ride was going to cost £20. I tried to book another Uber and the price had been upped to £40-50!! I had to go home late at night on the tube with a walk at the other end which I didn't feel comfortable with. ","June 28, 2019",1.0
"I tried to do instant pay at Wawa. Called. They said I needed to update my card info. When I did that it refused to let me update because of a security issue. I called. The guy said he couldn't help me. I asked for a manager and he continued to argue with me. I had to keep telling him to put someone else on the phone. I had to hang up and call back. Got someone else. He told me I'd just have to wait 45 minutes. So I waited. Updated the card info. Went to go instant pay... Locked me out of the system again saying security issue. Called back. Got the first guy again. Great I thought. I could hear plenty of people laughing in the background. He put me on hold saying it was to pull up my info, but really it was to wait for them to quiet down. ","March 18, 2019",1.0
"I needed to update my info in the app and it would not let me. I submitted a request to Uber and they refused to update my information saying they wanted my driver's license for proof of identity. They said in an automated email I have multiple accounts and I do not. They claim I'm a driver, which I am not. I have only ever been a rider. Now I have zero access to use the app and they refuse to communicate with me except through auto emails. I called the customer service line and the system tells me I'm not authorized to use the line because I'm not a premium user. This is BS. Horrible company and even worse customer service.","March 18, 2019",1.0
I have found Uber to be much more convenient than taxis and faster. Drivers have always been pleasant and helpful. When I'm travelling around the US and I'm in a new city it's a great way to get around.,"March 18, 2019",5.0
They extort money from people and get away with it. For example I bought an Uber card for 40.00 and it wouldn't work. Their answer was that I owed 20.00 to them when in fact it is impossible to owe Uber anything. So money was taken from us and we could never get it back. I am not the only person that has been stolen from in this way.,"March 18, 2019",1.0
"Living in a new area where public transportation is limited, this service is a life saver. I don't own a car and previously lived in a more urban area where I could walk to most places. I can pull out my phone and usually get an Uber in less than 6 minutes.","March 18, 2019",5.0
"Cheaper and nicer than taken cabs, have met some nice people. A lot of their drivers are very friendly and helpful. The savings alone are worth it because I don’t drink and drive and normal cab fee is $50.","March 18, 2019",5.0
"I ordered an Uber at the airport for me my boyfriend and his parents so 4 people and a couple luggages. The Uber pulled over, opened his truck and suddenly closed it and said We were too many passengers (which we weren’t) and told me to cancel the ride 'cause he wouldn’t take us and just drove off. I was really upset and cancelled as per the driver's instruction and was charged a 5$ cancellation fee. I’ve been talking back and forth with Uber customer service for 4 days now and they refuse to credit me the fee even though they admit I’m right and apologized for the bad experience. Their reasoning is that too many fare adjustments were made on my account (which were warranted 'cause I was indeed overcharged on a few trips). This completely irrelevant and a completely separate issue and they’re nickel and diming me over 5$. This makes absolutely no sense. The customer service quality has gone downhill from before.","March 17, 2019",1.0
"My wife and I are in our 70s and usually only use Uber when traveling out of our own area. Still, I'd say we've used Uber about 2 dozen times because we like to travel. All our experiences except two have been positive and those two weren't all that bad or scary just inconvenient. We flit back and forth from Uber to Lyft depending on where we are; some places tend to have more of an Uber presence, some more of a Lyft presence. Both are good values, overall.","March 17, 2019",4.0
I took Uber everyday and although I'm regular customer they treated me badly and made expensive trips for me although for others are cheap so I don't recommend Uber anymore. I'd like to join cream because it is better.,"March 17, 2019",1.0
"On 6/22 at 2:45PM I took an Uber. The driver (""Salaheddin"", who was a much larger man than me and could easily have removed me from his car) claimed that I was drinking in his car in the middle of the day and spilled it all over his seat. I demanded Uber refund the money and they showed me a picture of a cup with some liquid on it, and a car seat cover with some liquid on it. Probably not even his car.","June 28, 2019",1.0
"Uber's customer service department is absolute GARBAGE! All I needed was help changing my password because someone had hacked my account. They wanted information like my social security #, which I was not going to provide. There is no # to call them unless you pay for a premium membership - so I went to their chat support. 7 representatives came into the chat and left immediately without resolving my simple request! Or giving instructions on how to change my ** password! Lyft will have my business from here forward.","June 27, 2019",1.0
I was charged 60 dollars for a ride that was only 16 dollars. I was also put through hell just to get in contact with their support team who did nothing to credit my account. I was then told that it was given in UBER credit after they overdrafted my account. I am very upset that my issue has not been resolved and it happen a week ago. Bad customer support.,"June 25, 2019",1.0
"I usually don't use Uber but I went away and had no one to take me. I had a Uber gift card but not enough money for both ways. Instead of using the balance on the gift card and charging the rest to my regular card, they did not bother to charge my gift card. They refuse to give me a refund. Customer service is the absolute worst because there is absolutely no number to call. It is by email only. This company is ridiculous and I would find another company to use.","June 24, 2019",1.0
"I have driven with Lyft for quite some time and I have a 5 star driver rating. I say that to clarify it's not me. I have been trying to sign up to drive with Uber quite unsuccessfully for the better part of year. With two separate accounts even. Both times with both accounts after passing background checks and all other necessary REQUIREMENTS they have held me up each time because they claim I am submitting a profile picture that isn't visible. I have submitted photo after photo after photo after photo, some of which were currently being used and or accepted by Lyft and Hyre. So it cannot be possible that these photos are anything other than exactly what is requested.","June 24, 2019",1.0
"2 fraudulent trips on bank acct. Called Uber. Support only available thru app. I don't do data. Went to website. First time ever. My email was already in use. Used forgot password option 3 times. They sent LINK to reset password. I used it. Then a 4 digit code was required to complete password change. There was NO code in ANY of my emails from them. Can't sign in. Can't try to get my money back from the fraud. Bank still to investigate, but they had advised me to call Uber about it in case their investigation (claim) provided no results for me. WORST COMPANY EVER!!!","June 19, 2019",1.0
"I take pride in driving, that is why I am quitting today. During drive time I may pick up a lawyer, a wink, a prostitute or kids that need a diaper change or a random person who doesn't bath. My cars are cleaned 5 times a day and I carry spray. So for a guest in my car to say I need deodorizer that's rude. If I am driving through a green light and it turns yellow one cannot stop in the middle of the street. There is a reason a passenger doesn't have a car. Uber never asks the driver about the passenger reports, so I am quitting. I will never give one of these passengers a ride anywhere in my car. Uber cheats drivers daily, they only hire Asian customer service reps, and the guy who works at the San Bernardino green light is a huge ** who wears a sweater and basketball shorts. If you do not drive 12 hours the dispatch punishes drivers with 2.00 fares for up to six hours. That's why they are being sued for unfair practices.","June 19, 2019",1.0
"My first experience did not go well. I’m in Waikiki and needed a ride from a hotel to a restaurant for a scheduled luncheon. The app worked well and the driver was to arrive in 3 minutes. There were pick-up time adjustments as the 3 minutes passed and 15 minutes elapsed. We are now late for the luncheon when a text is received from the driver that he cancelled our ride. A new Uber request is sent and a driver dispatched with a, ""be there in 3 minutes."" No Uber after 6 minutes; however, the driver telephoned to indicate she was lost but should arrive soon. We stayed in touch by phone discussing her locations location as updates were provide. The car finally arrived and on our way to the luncheon arriving 50 minutes late. My return to the hotel from the restaurant went well.","June 18, 2019",3.0
